<?xml version="1.0" encoding="UTF-8"?>
<cms:CuemsProject xmlns:cms="http://stagelab.net/cuems" xmlns:xsi="http://www.w3.org/2001/XMLSchema-instance" xsi:schemaLocation="http://stagelab.net/cuems ../cuems/script.xsd">
    <CuemsScript>
        <uuid>12345678-MAIN-SCRI-ssss-000000000001</uuid>
        <name>Test Main Script</name>
        <created>2020-01-01T00:00:00</created>
        <modified>2020-01-01T00:00:00</modified>
        <cuelist>
            <timecode>False</timecode>
            <contents>
                <!-- Empty CueList -->
            </contents>
        </cuelist>
    </CuemsScript>
</cms:CuemsProject>